{
  "$schema": "https://json-schema.org/draft/2020-12/schema",
  "$id": "https://cam-assist.lutherie/schemas/traceability_bundle.schema.json",
  "title": "CAM Assist Traceability Bundle Schema",
  "description": "Portable, reference-only artifact that aggregates a package's traceability sidecars (assumptions, risk, decision record, annotations, lineage) so the complete manufacturing review story can move between systems as one unit. A navigational index, NOT the source of truth: the referenced sidecars remain authoritative. The bundle references files, it does not own, copy, cache, or supersede their content. Informational only: it does not grant execution authority, constitute approval, enforce workflow, or authorize machine execution. References are strings; structural validation does not require the referenced files to exist (existence is a completeness finding, not a structural error).",
  "type": "object",
  "required": ["record_type", "record_version", "package_reference", "bundle_contents"],
  "additionalProperties": false,

  "properties": {
    "record_type": {
      "type": "string",
      "const": "cam_assist_traceability_bundle",
      "description": "Must be 'cam_assist_traceability_bundle'"
    },

    "record_version": {
      "type": "string",
      "pattern": "^[0-9]+\\.[0-9]+\\.[0-9]+$",
      "description": "Semantic version of the traceability bundle record FORMAT. Not a content-revision counter."
    },

    "package_reference": {
      "type": "string",
      "minLength": 1,
      "description": "Reference to the package whose traceability story this bundle aggregates. Accepts federated_package_id, relative path, or package directory name."
    },

    "created_at": {
      "type": "string",
      "format": "date-time",
      "description": "ISO-8601 timestamp when this bundle record was created"
    },

    "bundle_contents": {
      "type": "object",
      "description": "Map of optional references to the package's traceability sidecars. Each value is a string path reference (resolved relative to the bundle's location). May be empty. References are navigational only; the referenced sidecars remain authoritative and are never owned, copied, or mutated by the bundle. Only the known slots below are permitted.",
      "additionalProperties": false,
      "properties": {
        "assumptions_file": {
          "type": "string",
          "minLength": 1,
          "description": "Optional reference to a manufacturing assumptions sidecar."
        },
        "risk_file": {
          "type": "string",
          "minLength": 1,
          "description": "Optional reference to a risk assessment sidecar."
        },
        "decision_record_file": {
          "type": "string",
          "minLength": 1,
          "description": "Optional reference to a manufacturing decision record sidecar."
        },
        "annotations_file": {
          "type": "string",
          "minLength": 1,
          "description": "Optional reference to a review annotations sidecar."
        },
        "lineage_file": {
          "type": "string",
          "minLength": 1,
          "description": "Optional reference to a revision lineage sidecar."
        }
      }
    },

    "authority": {
      "type": "object",
      "description": "Informational authority constraints. When present, every flag MUST be true.",
      "additionalProperties": false,
      "properties": {
        "is_informational": {
          "type": "boolean",
          "const": true,
          "description": "MUST be true. This record is informational only."
        },
        "does_not_authorize_execution": {
          "type": "boolean",
          "const": true,
          "description": "MUST be true. This record does not authorize machine execution."
        },
        "does_not_bypass_human_review": {
          "type": "boolean",
          "const": true,
          "description": "MUST be true. This record does not bypass required human review."
        }
      },
      "required": ["is_informational", "does_not_authorize_execution", "does_not_bypass_human_review"]
    }
  }
}
