{
  "record_type": "cam_assist_traceability_bundle",
  "record_version": "1.0.0",
  "package_reference": "luthiers-toolbox:vcarve:les-paul-custom-2024",
  "created_at": "2026-06-20T00:14:32.066221Z",
  "bundle_contents": {
    "assumptions_file": "ltb_vcarve_synthetic_example_assumptions.json",
    "risk_file": "ltb_vcarve_synthetic_example_risk.json",
    "decision_record_file": "ltb_vcarve_synthetic_example_decision_record.json",
    "lineage_file": "ltb_vcarve_synthetic_example_lineage.json",
    "annotations_file": "../review_annotations/ltb_vcarve_synthetic_example_annotations.json"
  },
  "authority": {
    "is_informational": true,
    "does_not_authorize_execution": true,
    "does_not_bypass_human_review": true
  }
}
